<?xml version="1.0" encoding="utf-8" ?>
<testData
    xmlns:xs="http://www.w3.org/2001/XMLSchema-instance"
    xs:noNamespaceSchemaLocation="BuildUrls.xsd">
  <builds>
    <build name="Scion" characterClassId="0" ascendancyClassId="0">
      <urls>
        <default>https://www.pathofexile.com/passive-skill-tree/AAAABAAAAA==</default>
      </urls>
      <description>Starting build for Scion.</description>
      <tags>starting</tags>
    </build>
    <build name="ScionAscendant" characterClassId="0" ascendancyClassId="1">
      <urls>
        <default>https://www.pathofexile.com/passive-skill-tree/AAAABAABAA==</default>
      </urls>
      <description>Starting build for Scion - Ascendant.</description>
      <tags>starting</tags>
    </build>
    <build name="Marauder" characterClassId="1" ascendancyClassId="0">
      <urls>
        <default>https://www.pathofexile.com/passive-skill-tree/AAAABAEAAA==</default>
      </urls>
      <description>Starting build for Marauder.</description>
      <tags>starting</tags>
    </build>
    <build name="MarauderJuggernaut" characterClassId="1" ascendancyClassId="1">
      <urls>
        <default>https://www.pathofexile.com/passive-skill-tree/AAAABAEBAA==</default>
      </urls>
      <description>Starting build for Marauder Juggernaut.</description>
      <tags>starting</tags>
    </build>
    <build name="MarauderBerserker" characterClassId="1" ascendancyClassId="2">
      <urls>
        <default>https://www.pathofexile.com/passive-skill-tree/AAAABAECAA==</default>
      </urls>
      <description>Starting build for Marauder Berserker.</description>
      <tags>starting</tags>
    </build>
    <build name="MarauderChieftain" characterClassId="1" ascendancyClassId="3">
      <urls>
        <default>https://www.pathofexile.com/passive-skill-tree/AAAABAEDAA==</default>
      </urls>
      <description>Starting build for Marauder Chieftain.</description>
      <tags>starting</tags>
    </build>
    <build name="Ranger" characterClassId="2" ascendancyClassId="0">
      <urls>
        <default>https://www.pathofexile.com/passive-skill-tree/AAAABAIAAA==</default>
      </urls>
      <description>Starting build for Ranger.</description>
      <tags>starting</tags>
    </build>
    <build name="RangerRaider" characterClassId="2" ascendancyClassId="1">
      <urls>
        <default>https://www.pathofexile.com/passive-skill-tree/AAAABAIBAA==</default>
      </urls>
      <description>Starting build for Ranger Raider.</description>
      <tags>starting</tags>
    </build>
    <build name="RangerDeadeye" characterClassId="2" ascendancyClassId="2">
      <urls>
        <default>https://www.pathofexile.com/passive-skill-tree/AAAABAICAA==</default>
      </urls>
      <description>Starting build for Ranger Deadeye.</description>
      <tags>starting</tags>
    </build>
    <build name="RangerPathfinder" characterClassId="2" ascendancyClassId="3">
      <urls>
        <default>https://www.pathofexile.com/passive-skill-tree/AAAABAIDAA==</default>
      </urls>
      <description>Starting build for Ranger Pathfinder.</description>
      <tags>starting</tags>
    </build>
    <build name="Witch" characterClassId="3" ascendancyClassId="0">
      <urls>
        <default>https://www.pathofexile.com/passive-skill-tree/AAAABAMAAA==</default>
      </urls>
      <description>Starting build for Witch.</description>
      <tags>starting</tags>
    </build>
    <build name="WitchOccultist" characterClassId="3" ascendancyClassId="1">
      <urls>
        <default>https://www.pathofexile.com/passive-skill-tree/AAAABAMBAA==</default>
      </urls>
      <description>Starting build for Witch Occultist.</description>
      <tags>starting</tags>
    </build>
    <build name="WitchElementalist" characterClassId="3" ascendancyClassId="2">
      <urls>
        <default>https://www.pathofexile.com/passive-skill-tree/AAAABAMCAA==</default>
      </urls>
      <description>Starting build for Witch Elementalist.</description>
      <tags>starting</tags>
    </build>
    <build name="WitchNecromancer" characterClassId="3" ascendancyClassId="3">
      <urls>
        <default>https://www.pathofexile.com/passive-skill-tree/AAAABAMDAA==</default>
      </urls>
      <description>Starting build for Witch Necromancer.</description>
      <tags>starting</tags>
    </build>
    <build name="Duelist" characterClassId="4" ascendancyClassId="0">
      <urls>
        <default>https://www.pathofexile.com/passive-skill-tree/AAAABAQAAA==</default>
      </urls>
      <description>Starting build for Duelist.</description>
      <tags>starting</tags>
    </build>
    <build name="DuelistSlayer" characterClassId="4" ascendancyClassId="1">
      <urls>
        <default>https://www.pathofexile.com/passive-skill-tree/AAAABAQBAA==</default>
      </urls>
      <description>Starting build for Duelist Slayer.</description>
      <tags>starting</tags>
    </build>
    <build name="DuelistGladiator" characterClassId="4" ascendancyClassId="2">
      <urls>
        <default>https://www.pathofexile.com/passive-skill-tree/AAAABAQCAA==</default>
      </urls>
      <description>Starting build for Duelist Gladiator.</description>
      <tags>starting</tags>
    </build>
    <build name="DuelistChampion" characterClassId="4" ascendancyClassId="3">
      <urls>
        <default>https://www.pathofexile.com/passive-skill-tree/AAAABAQDAA==</default>
      </urls>
      <description>Starting build for Duelist Champion.</description>
      <tags>starting</tags>
    </build>
    <build name="Templar" characterClassId="5" ascendancyClassId="0">
      <urls>
        <default>https://www.pathofexile.com/passive-skill-tree/AAAABAUAAA==</default>
      </urls>
      <description>Starting build for Templar.</description>
      <tags>starting</tags>
    </build>
    <build name="TemplarInquisitor" characterClassId="5" ascendancyClassId="1">
      <urls>
        <default>https://www.pathofexile.com/passive-skill-tree/AAAABAUBAA==</default>
      </urls>
      <description>Starting build for Templar Inquisitor.</description>
      <tags>starting</tags>
    </build>
    <build name="TemplarHierophant" characterClassId="5" ascendancyClassId="2">
      <urls>
        <default>https://www.pathofexile.com/passive-skill-tree/AAAABAUCAA==</default>
      </urls>
      <description>Starting build for Templar Hierophant.</description>
      <tags>starting</tags>
    </build>
    <build name="TemplarGuardian" characterClassId="5" ascendancyClassId="3">
      <urls>
        <default>https://www.pathofexile.com/passive-skill-tree/AAAABAUDAA==</default>
      </urls>
      <description>Starting build for Templar Guardian.</description>
      <tags>starting</tags>
    </build>
    <build name="Shadow" characterClassId="6" ascendancyClassId="0">
      <urls>
        <default>https://www.pathofexile.com/passive-skill-tree/AAAABAYAAA==</default>
      </urls>
      <description>Starting build for Shadow.</description>
      <tags>starting</tags>
    </build>
    <build name="ShadowAssassin" characterClassId="6" ascendancyClassId="1">
      <urls>
        <default>https://www.pathofexile.com/passive-skill-tree/AAAABAYBAA==</default>
      </urls>
      <description>Starting build for Shadow Assassin.</description>
      <tags>starting</tags>
    </build>
    <build name="ShadowTrickster" characterClassId="6" ascendancyClassId="2">
      <urls>
        <default>https://www.pathofexile.com/passive-skill-tree/AAAABAYCAA==</default>
      </urls>
      <description>Starting build for Shadow Trickster.</description>
      <tags>starting</tags>
    </build>
    <build name="ShadowSaboteur" characterClassId="6" ascendancyClassId="3">
      <urls>
        <default>https://www.pathofexile.com/passive-skill-tree/AAAABAYDAA==</default>
      </urls>
      <description>Starting build for Shadow Saboteur.</description>
      <tags>starting</tags>
    </build>
  </builds>
</testData>